{
  "$schema": "../theme.schema.json",
  "format": 1,
  "id": "default",
  "name": "Default",
  "description": "The neutral, generic look of the open-source core: dark slate plates, system faces, no art. Holds the fixed status palette, the text neutrals and the glyph set every theme inherits.",
  "extends": null,
  "spec": "docs/theme-spec.md",
  "licence": {"art": "CC0-1.0", "fonts": "none shipped (system faces)"},
  "fonts": [],
  "faces": {
    "pixel": ["ui-monospace", "Cascadia Mono", "Menlo", "Consolas", "monospace"],
    "numeral": ["Bahnschrift", "DIN Alternate", "Roboto Condensed", "system-ui", "sans-serif"],
    "data": [
      "Segoe UI Variable Text",
      "Segoe UI",
      "-apple-system",
      "SF Pro Text",
      "Ubuntu Sans",
      "Roboto",
      "Helvetica Neue",
      "Arial",
      "sans-serif"
    ],
    "load": {"font_display": "swap"},
    "adjust": {"$comment": "font-size-adjust per face, so a system face keeps the cap height the roles are sized for (Jersey 15: 15 of 27 px)", "numeral": "cap-height 0.556", "pixel": "cap-height 0.727"}
  },
  "grid": {
    "canvas_ap": [640, 360],
    "tile_ap": 8,
    "art_px_device": {"tv_4k": 6, "tv_1440p": 4, "tv_1080": 3, "phone_dpr3": 6, "phone_dpr2": 4},
    "tv_rule": "ap_dev = max(1, floor(min(viewport_w_dev / 640, viewport_h_dev / 360))); ap_css = ap_dev / devicePixelRatio",
    "phone_rule": "ap_dev = max(2, round(2 * devicePixelRatio)); ap_css = ap_dev / devicePixelRatio",
    "phone_breakpoint_css": 700,
    "pixel_font": "fp_dev = ceil(14 * devicePixelRatio / 11); label font-size = 11 * fp_dev / devicePixelRatio CSS px",
    "numeral_font": "font-size = 27 * n / devicePixelRatio CSS px for a whole n (device px per font px)",
    "centre": "offsets floored to whole device px",
    "smoothing": "image-rendering: pixelated on every bitmap; canvases at one canvas px per art px",
    "corners": "pixel steps (notch_ap), never border-radius",
    "pixelated": false
  },
  "space": {
    "$comment": "Every length is a whole number of art px. Steps, then named roles.",
    "steps_ap": [0, 1, 2, 3, 4, 6, 8, 10, 12, 16, 20, 24],
    "roles_ap": {
      "hair": 1,
      "bevel": 1,
      "notch": 1,
      "frame_call": 4,
      "gap_inline": 4,
      "gap_col": 6,
      "gap_row": 4,
      "gap_section": 8,
      "gap_zone": 6,
      "inset_plate": 10,
      "inset_call": 12,
      "inset_bar": 8,
      "margin_side": 20,
      "margin_top": 8,
      "margin_bottom": 8
    }
  },
  "type": {
    "$comment": "Same roles and sizes as every theme (the core lays out by role). The default theme uses system faces, so 'pixel' means the system monospace and the arcminutes assume a cap of about 0.7 em; the integer grid still applies to layout.",
    "floor_arcmin": 16,
    "glance_arcmin": 20,
    "hero_arcmin": 60,
    "roles": {
      "label": {
        "face": "pixel",
        "size_ap": 11,
        "line_ap": 11,
        "weight": 400,
        "case": "upper",
        "font_px_per_art_px": 1,
        "cap_ap": 8.0,
        "tv_4k": {"font_dev_px": 66, "cap_dev_px": 48.0, "arcmin_3m_55in": 17.4, "arcmin_3m_65in": 20.6},
        "tv_1080": {"font_dev_px": 33, "cap_dev_px": 24.0},
        "phone": {"css_px": 14.667, "line_css_px": 16, "rule": "pixel_font", "arcmin_35cm_dpr3": 17.4},
        "use": "labels, state words, ages, ranges, machine names, log header"
      },
      "label_lg": {
        "face": "pixel",
        "size_ap": 22,
        "line_ap": 22,
        "weight": 400,
        "case": "upper",
        "font_px_per_art_px": 2,
        "cap_ap": 16.0,
        "tv_4k": {"font_dev_px": 132, "cap_dev_px": 96.0, "arcmin_3m_55in": 34.9, "arcmin_3m_65in": 41.3},
        "tv_1080": {"font_dev_px": 66, "cap_dev_px": 48.0},
        "phone": {"css_px": 18.333, "line_css_px": 20, "rule": "pixel_font", "arcmin_35cm_dpr3": 21.7},
        "use": "HAILING in place of the countdown digit while a try is in flight"
      },
      "numeral": {
        "face": "numeral",
        "size_ap": 27,
        "line_ap": 16,
        "weight": 400,
        "font_px_per_art_px": 1,
        "cap_ap": 15.0,
        "tv_4k": {"font_dev_px": 162, "cap_dev_px": 90.0, "arcmin_3m_55in": 32.7, "arcmin_3m_65in": 38.7},
        "tv_1080": {"font_dev_px": 81, "cap_dev_px": 45.0},
        "phone": {"css_px": 27, "line_css_px": 18, "rule": "numeral_font", "arcmin_35cm_dpr3": 24.4},
        "use": "clock, landed score, all-clear count line"
      },
      "numeral_hero": {
        "face": "numeral",
        "size_ap": 54,
        "line_ap": 30,
        "weight": 400,
        "font_px_per_art_px": 2,
        "cap_ap": 30.0,
        "tv_4k": {"font_dev_px": 324, "cap_dev_px": 180.0, "arcmin_3m_55in": 65.4, "arcmin_3m_65in": 77.3},
        "tv_1080": {"font_dev_px": 162, "cap_dev_px": 90.0},
        "phone": {"css_px": 54, "line_css_px": 32, "rule": "numeral_font", "arcmin_35cm_dpr3": 48.8},
        "use": "the count on the call band (the biggest number on the board)"
      },
      "numeral_clock_rest": {
        "face": "numeral",
        "size_ap": 81,
        "line_ap": 46,
        "weight": 400,
        "font_px_per_art_px": 3,
        "cap_ap": 45.0,
        "tv_4k": {"font_dev_px": 486, "cap_dev_px": 270.0, "arcmin_3m_55in": 98.1, "arcmin_3m_65in": 116.0},
        "tv_1080": {"font_dev_px": 243, "cap_dev_px": 135.0},
        "use": "the anchor (sleep) clock, TV only"
      },
      "numeral_countdown": {
        "face": "numeral",
        "size_ap": 108,
        "line_ap": 61,
        "weight": 400,
        "font_px_per_art_px": 4,
        "cap_ap": 60.0,
        "tv_4k": {"font_dev_px": 648, "cap_dev_px": 360.0, "arcmin_3m_55in": 130.7, "arcmin_3m_65in": 154.6},
        "tv_1080": {"font_dev_px": 324, "cap_dev_px": 180.0},
        "phone": {"css_px": 81, "line_css_px": 48, "rule": "numeral_font", "arcmin_35cm_dpr3": 73.2},
        "use": "seconds to the next hail (host down)"
      },
      "title": {
        "face": "data",
        "size_ap": 13,
        "line_ap": 15,
        "weight": 680,
        "cap_ap": 8.68,
        "tv_4k": {"font_dev_px": 78, "cap_dev_px": 52.1, "arcmin_3m_55in": 18.9, "arcmin_3m_65in": 22.4},
        "tv_1080": {"font_dev_px": 39, "cap_dev_px": 26.1},
        "phone": {"css_px": 19, "line_css_px": 24, "arcmin_35cm_dpr3": 20.7},
        "use": "top call title, alarm title"
      },
      "title_log": {
        "face": "data",
        "size_ap": 12,
        "line_ap": 14,
        "weight": 650,
        "cap_ap": 8.02,
        "tv_4k": {"font_dev_px": 72, "cap_dev_px": 48.1, "arcmin_3m_55in": 17.5, "arcmin_3m_65in": 20.7},
        "tv_1080": {"font_dev_px": 36, "cap_dev_px": 24.0},
        "phone": {"css_px": 18, "line_css_px": 23, "arcmin_35cm_dpr3": 19.6},
        "use": "lane titles in the ship's log"
      },
      "statement": {
        "face": "data",
        "size_ap": 16,
        "line_ap": 19,
        "weight": 650,
        "cap_ap": 10.69,
        "tv_4k": {"font_dev_px": 96, "cap_dev_px": 64.1, "arcmin_3m_55in": 23.3, "arcmin_3m_65in": 27.6},
        "tv_1080": {"font_dev_px": 48, "cap_dev_px": 32.1},
        "phone": {"css_px": 21, "line_css_px": 26, "arcmin_35cm_dpr3": 22.8},
        "use": "'Nothing waits on you.' on the anchor plate; hailing sentence"
      },
      "notice_title": {
        "face": "data",
        "size_ap": 14,
        "line_ap": 17,
        "weight": 680,
        "cap_ap": 9.35,
        "tv_4k": {"font_dev_px": 84, "cap_dev_px": 56.1, "arcmin_3m_55in": 20.4, "arcmin_3m_65in": 24.1},
        "tv_1080": {"font_dev_px": 42, "cap_dev_px": 28.1},
        "phone": {"css_px": 19, "line_css_px": 24, "arcmin_35cm_dpr3": 20.7},
        "use": "lost-contact and empty notices"
      },
      "body": {
        "face": "data",
        "size_ap": 11,
        "line_ap": 13,
        "weight": 450,
        "cap_ap": 7.35,
        "tv_4k": {"font_dev_px": 66, "cap_dev_px": 44.1, "arcmin_3m_55in": 16.0, "arcmin_3m_65in": 18.9},
        "tv_1080": {"font_dev_px": 33, "cap_dev_px": 22.0},
        "phone": {"css_px": 16, "line_css_px": 21, "arcmin_35cm_dpr3": 17.4},
        "use": "where to act, other calls, log details, bar sub-lines: the TV floor"
      },
      "body_quiet": {
        "face": "data",
        "size_ap": 12,
        "line_ap": 15,
        "weight": 450,
        "cap_ap": 8.02,
        "tv_4k": {"font_dev_px": 72, "cap_dev_px": 48.1, "arcmin_3m_55in": 17.5, "arcmin_3m_65in": 20.7},
        "tv_1080": {"font_dev_px": 36, "cap_dev_px": 24.0},
        "phone": {"css_px": 16, "line_css_px": 21, "arcmin_35cm_dpr3": 17.4},
        "use": "the one quiet line on the anchor plate"
      }
    },
    "numerals": "tabular-nums",
    "tracking": 0,
    "phone_floor_css_px": 15
  },
  "color": {
    "$comment": "status and ink are core: every theme inherits them unchanged. surface is this theme's fill of the core roles.",
    "status": {
      "day": {"needs": "#F7B733", "trouble": "#FF5F4A", "moving": "#5C9DFF", "done": "#93DDB4"},
      "night": {"needs": "#C49023", "trouble": "#D55240", "moving": "#4974B5", "done": "#6A717B"},
      "sleep": {"needs": "#C49023", "trouble": "#D55240", "moving": "#4974B5", "done": "#6A717B"}
    },
    "ink": {
      "day": {"ink": "#E8ECF1", "ink2": "#B4BDC9", "fog": "#8D97A5"},
      "night": {"ink": "#8F9397", "ink2": "#747B85", "fog": "#747B85"},
      "sleep": {"ink": "#868B91", "ink2": "#7A8088", "fog": "#7A8088", "clock": "#6A7078"}
    },
    "surface": {
      "day": {
        "glyph_ink": "#080A0E",
        "ground": "#0E1217",
        "panel": "#151A22",
        "panel_hi": "#2A3240",
        "panel_lo": "#080A0E",
        "rule": "#2A3240",
        "track": "#222A36",
        "call": "#1B2230",
        "call_edge": "#F7B733",
        "call_ink": "#E8ECF1",
        "call_ink2": "#B4BDC9",
        "call_band": "#F7B733",
        "call_band_ink": "#1C1206"
      },
      "night": {
        "glyph_ink": "#000000",
        "ground": "#07090C",
        "panel": "#0B0E12",
        "panel_hi": "#1A1F27",